{
  "schema_version": "1",
  "task_id": "task-8873feba07b8",
  "repository": "ai-platform/agent-sandbox",
  "base_sha": "5f1c2b3a4d5e6f708192a3b4c5d6e7f8091a2b3c",
  "summary": "Fix typo in documentation index.",
  "assumptions": [],
  "questions": [],
  "proposed_changes": [
    {"path": "docs/index.md", "reason": "typo fix"}
  ],
  "test_commands": ["pytest -q"],
  "risks": [],
  "requires_human_input": false,
  "plan_hash": ""
}
